{
	"Name"                  : "Polygram",
	"Description"           : "Polygram demo: regular polygons (eg. pentagon) and regular star polygons (eg. Pentagram)",
	"Reference"             : "https://en.wikipedia.org/wiki/Polygram_(geometry)",
    "CellSize"              : "25",
	"MaxCellValue"          : "7",
    "CellValueMode"         : "Random",
	"NumberFormat"			: "absolute",
    "BackgroundColor"       : "#b9b9b9",
	
	"Variables"             : { "DigitMark": { "type": "digit_mark", "position": ["5", "5"] }			
							  },
							  
	"Shapes"				: { "0":	{   "type": "ComboShape",
											"parts": [	
												{ "type": "polygram", "drawThickness": 1,
												  "vertex_count": 5, "position": "center", "size": 23, 
												  "fillColor": "yellow" },
												{ "type": "polygram", "drawThickness": 1,
												  "vertex_count": 5, "is_star": "true",
												  "position": "center", "size": 18, "fillColor": "red" },
												"$DigitMark"
											]
										},
								"1":	{	"type": "ComboShape",
											"parts": [
												{ "type": "polygram", "drawThickness": 1,
												  "vertex_count": 4, "position": "center", "size": 18, 
											      "fillColor": "pink" },
												{ "type": "polygram", "drawThickness": 1,
												  "is_star": "true", "vertex_count": 4,
												  "position": "center", "size": 12, "fillColor": "white" },
												"$DigitMark"
											]
										},
								"2":	{	"type": "ComboShape",
											"parts": [
												{ "type": "polygram",
												  "vertex_count": "6", "Z": "min",
												  "position": "center", "size": 14, "fillColor": "white" },
												{ "type": "circle", "drawThickness": 1, "Z": "max",
												  "position": "center", "size": 5, "fillColor": "black" },
												"$DigitMark"
											]
										},
								"3":	{	"type": "ComboShape",
											"parts": [	
												{ "type": "line", "start": "NW", "end": "SE" },
												{ "type": "polygram", "drawThickness": 1,
												  "vertex_count": 6, "position": "center", "size": 20, 
												  "fillColor": "yellow" },
												{ "type": "polygram", "drawThickness": 1,
												  "is_star": "true", "vertex_count": 6, 
												  "position": "center", "size": 16, "fillColor": "magenta" },
												"$DigitMark"
											]
										},
								"4":	{	"type": "ComboShape",
											"parts": [
												{ "type": "circle",
												  "position": "SE", "size": 17,
											      "drawColor": "yellow", "fillColor": "red" },
												{ "type": "square", "Z": "1",
												  "position": "center", "size": 10,
											      "drawColor": "red", "fillColor": "yellow" },
												{ "type": "line", 
												  "start": "center", "end": "NE" },
												"$DigitMark"
											]
										},
								"5":	{	"type": "ComboShape",
											"parts": [
												{ "type": "polygram", 
												  "is_star": "true", "vertex_count": 8,
												  "drawThickness": 1, "Z": "1", "position": "NW", "size": 22,
											      "fillColor": "lightgrey" },
												{ "type": "line", "start": "NW", "end": "SE" },
												{ "type": "circle", "Z": "1", "position": "SE", "size": 13,
											      "fillColor": "lightgreen" },
												"$DigitMark"
											]
										},
								"6":	{	"type": "ComboShape",
											"parts": [
												{ "type": "line", "start": "center", "end": "SE" },
												{ "type": "square", "Z": "1", "position": "SE", "size": 9,
											      "fillColor": "orange" },
												"$DigitMark"
											]
										},
								"7":	{	"type": "ComboShape",
											"parts": [
												{ "type": "line", "start": "center", "end": "SE" },
												{ "type": "losange", "position": "NW", "size": 9,
											      "drawColor": "white", "fillColor": "black" },
												"$DigitMark"
											]
										}
								}							
}